{
  "$schema": "https://json-schema.org/draft/2020-12/schema",
  "$id": "https://boswelldigitalsolutions.com/schemas/cortex/service-status.schema.json",
  "title": "Cortex Service Status",
  "description": "Bounded operator-visible service-status envelope for Cortex.",
  "type": "object",
  "additionalProperties": false,
  "required": [
    "service_id",
    "service_class",
    "state",
    "runtime_surface_summary",
    "operator_visible_message",
    "last_updated_at"
  ],
  "properties": {
    "service_id": {
      "type": "string",
      "const": "cortex"
    },
    "service_class": {
      "type": "string",
      "const": "file_intelligence"
    },
    "state": {
      "type": "string",
      "enum": [
        "ready",
        "degraded",
        "unavailable",
        "denied",
        "stale",
        "partial_success"
      ]
    },
    "degraded_subtype": {
      "type": "string",
      "enum": [
        "degraded",
        "extraction_incomplete",
        "integrity_failed",
        "re_prep_required",
        "dependency_unavailable",
        "observation_contract_missing",
        "freshness_unknown"
      ]
    },
    "denied_state": {
      "type": "object",
      "additionalProperties": false,
      "required": [
        "state",
        "reason_class",
        "scope",
        "remediable",
        "operator_visible_summary",
        "last_updated_at"
      ],
      "properties": {
        "state": {
          "type": "string",
          "const": "denied"
        },
        "reason_class": {
          "type": "string",
          "enum": [
            "contract_invalid",
            "ineligible_source",
            "privacy_scope_violation",
            "integrity_failed",
            "semantic_request_not_allowed",
            "dependency_unavailable",
            "unsupported_source_type",
            "operator_disabled"
          ]
        },
        "scope": {
          "type": "string",
          "enum": [
            "request",
            "source",
            "service",
            "artifact",
            "observation_contract"
          ]
        },
        "remediable": {
          "type": "boolean"
        },
        "operator_visible_summary": {
          "type": "string",
          "minLength": 1,
          "maxLength": 300
        },
        "last_updated_at": {
          "type": "string",
          "format": "date-time"
        }
      }
    },
    "readiness_summary": {
      "type": "object",
      "additionalProperties": false,
      "required": [
        "readiness_class",
        "summary"
      ],
      "properties": {
        "readiness_class": {
          "type": "string",
          "enum": [
            "ready",
            "ready_with_constraints",
            "degraded",
            "not_ready"
          ]
        },
        "summary": {
          "type": "string",
          "minLength": 1,
          "maxLength": 300
        }
      }
    },
    "watcher_summary": {
      "type": "object",
      "additionalProperties": false,
      "required": [
        "active_watch_scope_count",
        "contract_scoped_only"
      ],
      "properties": {
        "active_watch_scope_count": {
          "type": "integer",
          "minimum": 0
        },
        "contract_scoped_only": {
          "type": "boolean",
          "const": true
        }
      }
    },
    "gnat_summary": {
      "type": "object",
      "additionalProperties": false,
      "required": [
        "profile",
        "admitted_worker_types",
        "max_concurrency",
        "hard_cap",
        "fa_local_required_for_parallel",
        "fa_local_state",
        "parallel_execution_ready",
        "serial_fallback_available"
      ],
      "properties": {
        "profile": {
          "type": "string",
          "enum": [
            "serial_contract_proof",
            "bounded_parallel_extraction"
          ]
        },
        "admitted_worker_types": {
          "type": "array",
          "uniqueItems": true,
          "items": {
            "type": "string",
            "enum": [
              "markdown_syntax",
              "plain_text_syntax",
              "pdf_text_syntax",
              "docx_text_syntax",
              "rtf_text_syntax",
              "odt_text_syntax"
            ]
          }
        },
        "max_concurrency": {
          "type": "integer",
          "minimum": 1,
          "maximum": 8
        },
        "hard_cap": {
          "type": "integer",
          "const": 8
        },
        "fa_local_required_for_parallel": {
          "type": "boolean",
          "const": true
        },
        "fa_local_state": {
          "type": "string",
          "enum": [
            "unknown",
            "ready",
            "degraded",
            "unavailable"
          ]
        },
        "parallel_execution_ready": {
          "type": "boolean"
        },
        "serial_fallback_available": {
          "type": "boolean"
        }
      }
    },
    "runtime_surface_summary": {
      "type": "object",
      "additionalProperties": false,
      "required": [
        "implemented_slices",
        "admitted_source_lanes",
        "bounded_runtime_only"
      ],
      "properties": {
        "implemented_slices": {
          "type": "array",
          "uniqueItems": true,
          "items": {
            "type": "string",
            "enum": [
              "slice1_intake_validation",
              "slice2_extraction_emission",
              "slice3_retrieval_package_emission",
              "slice4_service_status_truth",
              "slice5_pdf_source_lane",
              "slice6_docx_source_lane",
              "slice7_rtf_source_lane",
              "slice8_odt_source_lane",
              "slice9_epub_source_lane",
              "slice10_scrivener_stage1_authority_recon"
            ]
          }
        },
        "admitted_source_lanes": {
          "type": "array",
          "uniqueItems": true,
          "items": {
            "type": "string",
            "enum": [
              "local_file_markdown",
              "local_file_plain_text",
              "local_file_pdf_text",
              "local_file_docx_text",
              "local_file_rtf_text",
              "local_file_odt_text",
              "local_file_epub_text"
            ]
          }
        },
        "bounded_runtime_only": {
          "type": "boolean",
          "const": true
        }
      }
    },
    "operator_visible_message": {
      "type": "string",
      "minLength": 1,
      "maxLength": 500
    },
    "details_redacted": {
      "type": "boolean",
      "default": true
    },
    "last_updated_at": {
      "type": "string",
      "format": "date-time"
    }
  },
  "allOf": [
    {
      "if": {
        "properties": {
          "state": {
            "const": "degraded"
          }
        },
        "required": [
          "state"
        ]
      },
      "then": {
        "required": [
          "degraded_subtype"
        ]
      }
    },
    {
      "if": {
        "properties": {
          "state": {
            "const": "denied"
          }
        },
        "required": [
          "state"
        ]
      },
      "then": {
        "required": [
          "denied_state"
        ]
      }
    }
  ]
}
