{
  "service_id": "cortex",
  "service_class": "file_intelligence",
  "state": "stale",
  "readiness_summary": {
    "readiness_class": "ready_with_constraints",
    "summary": "Cortex is reachable, but one or more current artifacts are explicitly stale."
  },
  "runtime_surface_summary": {
    "implemented_slices": [
      "slice1_intake_validation",
      "slice2_extraction_emission",
      "slice3_retrieval_package_emission",
      "slice4_service_status_truth",
      "slice5_pdf_source_lane",
      "slice6_docx_source_lane",
      "slice7_rtf_source_lane"
    ],
    "admitted_source_lanes": [
      "local_file_markdown",
      "local_file_plain_text",
      "local_file_pdf_text",
      "local_file_docx_text",
      "local_file_rtf_text"
    ],
    "bounded_runtime_only": true
  },
  "watcher_summary": {
    "active_watch_scope_count": 1,
    "contract_scoped_only": true
  },
  "operator_visible_message": "Cortex is stale for one or more bounded artifacts until freshness is reasserted.",
  "details_redacted": true,
  "last_updated_at": "2026-03-19T12:21:00Z"
}
