{
  "service_id": "cortex",
  "service_class": "file_intelligence",
  "state": "degraded",
  "degraded_subtype": "extraction_incomplete",
  "readiness_summary": {
    "readiness_class": "degraded",
    "summary": "Extraction completed with incomplete structure capture for one or more artifacts."
  },
  "runtime_surface_summary": {
    "implemented_slices": [
      "slice1_intake_validation",
      "slice2_extraction_emission",
      "slice3_retrieval_package_emission",
      "slice4_service_status_truth"
    ],
    "admitted_source_lanes": [
      "local_file_markdown",
      "local_file_plain_text"
    ],
    "bounded_runtime_only": true
  },
  "watcher_summary": {
    "active_watch_scope_count": 1,
    "contract_scoped_only": true
  },
  "operator_visible_message": "Cortex is degraded: extraction completeness is reduced for the current artifact set.",
  "details_redacted": true,
  "last_updated_at": "2026-03-19T10:04:00Z"
}
