{
  "service_id": "cortex",
  "service_class": "file_intelligence",
  "state": "ready",
  "readiness_summary": {
    "readiness_class": "ready",
    "summary": "Cortex is ready for slices 1 through 4 on bounded local Markdown and plain-text lanes."
  },
  "runtime_surface_summary": {
    "implemented_slices": [
      "slice1_intake_validation",
      "slice2_extraction_emission",
      "slice3_retrieval_package_emission",
      "slice4_service_status_truth"
    ],
    "admitted_source_lanes": [
      "local_file_markdown",
      "local_file_plain_text"
    ],
    "bounded_runtime_only": true
  },
  "watcher_summary": {
    "active_watch_scope_count": 0,
    "contract_scoped_only": true
  },
  "operator_visible_message": "Cortex is ready for bounded intake, extraction, retrieval-package, and service-status runtime paths on local Markdown and plain-text files.",
  "details_redacted": true,
  "last_updated_at": "2026-03-19T12:24:00Z"
}
