{
  "service_id": "cortex",
  "service_class": "file_intelligence",
  "state": "denied",
  "denied_state": {
    "state": "denied",
    "reason_class": "operator_disabled",
    "scope": "service",
    "remediable": true,
    "operator_visible_summary": "Cortex intake is operator-disabled for the current bounded profile.",
    "last_updated_at": "2026-03-19T12:20:00Z"
  },
  "readiness_summary": {
    "readiness_class": "not_ready",
    "summary": "Cortex is not ready because the service is explicitly disabled for this bounded action."
  },
  "runtime_surface_summary": {
    "implemented_slices": [
      "slice1_intake_validation",
      "slice2_extraction_emission",
      "slice3_retrieval_package_emission",
      "slice4_service_status_truth",
      "slice5_pdf_source_lane",
      "slice6_docx_source_lane",
      "slice7_rtf_source_lane",
      "slice8_odt_source_lane"
    ],
    "admitted_source_lanes": [
      "local_file_markdown",
      "local_file_plain_text",
      "local_file_pdf_text",
      "local_file_docx_text",
      "local_file_rtf_text",
      "local_file_odt_text"
    ],
    "bounded_runtime_only": true
  },
  "operator_visible_message": "Cortex is denied for the requested service action.",
  "details_redacted": true,
  "last_updated_at": "2026-03-19T12:20:00Z"
}
